536365,536366,536367,536368,536369__-,536370,536371__-,536372,536373,536374__-,536375,536376,536377,536378,536380__-,536381,C536379__-,536382,C536383__-,536384,536385,536386,536387,536388,536389,536390,C536391,536392,536393__-,536394,536395,536396,536397,536398,536399,536400__-,536401,536402,536403,536404,536405__-,536406,536407,536408,536409,536412
WHITE HANGING HEART T-LIGHT HOLDER,HAND WARMER UNION JACK,ASSORTED COLOUR BIRD ORNAMENT,JAM MAKING SET WITH JARS,BATH BUILDING BLOCK WORD,ALARM CLOCK BAKELIKE PINK,PAPER CHAIN KIT 50'S CHRISTMAS ,HAND WARMER RED POLKA DOT,WHITE HANGING HEART T-LIGHT HOLDER,VICTORIAN SEWING BOX LARGE,WHITE HANGING HEART T-LIGHT HOLDER,HOT WATER BOTTLE TEA AND SYMPATHY,HAND WARMER RED POLKA DOT,JUMBO BAG PINK POLKADOT,JAM MAKING SET PRINTED,RETROSPOT TEA SET CERAMIC 11 PC ,Discount,INFLATABLE POLITICAL GLOBE ,SET OF 3 COLOURED  FLYING DUCKS,WOOD BLACK BOARD ANT WHITE FINISH,SET 3 WICKER OVAL BASKETS W LIDS,WHITE WIRE EGG HOLDER,CHILLI LIGHTS,HOME BUILDING BLOCK WORD,CHRISTMAS LIGHTS 10 REINDEER,CHRISTMAS LIGHTS 10 REINDEER,PLASTERS IN TIN CIRCUS PARADE ,3 STRIPEY MICE FELTCRAFT,RETROSPOT LAMP,"FANCY FONT BIRTHDAY CARD, ",BLACK HEART CARD HOLDER,WHITE HANGING HEART T-LIGHT HOLDER,SET OF 3 BLACK FLYING DUCKS,PACK OF 12 RED RETROSPOT TISSUES ,HAND WARMER RED POLKA DOT,HOMEMADE JAM SCENTED CANDLES,BIRD HOUSE HOT WATER BOTTLE,PAPER CHAIN KIT 50'S CHRISTMAS ,HAND WARMER BIRD DESIGN,HEART IVORY TRELLIS SMALL,SET/5 RED RETROSPOT LID GLASS BOWLS,WHITE HANGING HEART T-LIGHT HOLDER,HAND WARMER RED POLKA DOT,MAGIC DRAWING SLATE DINOSAUR,5 STRAND GLASS NECKLACE CRYSTAL,LUNCH BAG CARS BLUE
WHITE HANGING HEART T-LIGHT HOLDER,HAND WARMER RED POLKA DOT,POPPY'S PLAYHOUSE BEDROOM ,RED COAT RACK PARIS FASHION,,ALARM CLOCK BAKELIKE RED ,,HAND WARMER UNION JACK,WHITE METAL LANTERN,,WHITE METAL LANTERN,RED HANGING HEART T-LIGHT HOLDER,HAND WARMER UNION JACK,JUMBO  BAG BAROQUE BLACK WHITE,,GIRLY PINK TOOL SET,,VINTAGE SNAKES & LADDERS,,COLOUR GLASS T-LIGHT HOLDER HANGING,JAM MAKING SET PRINTED,JUMBO  BAG BAROQUE BLACK WHITE,LIGHT GARLAND BUTTERFILES PINK,LOVE BUILDING BLOCK WORD,VINTAGE UNION JACK CUSHION COVER,JAM MAKING SET WITH JARS,PACK OF 12 PINK PAISLEY TISSUES ,SET OF 6 SOLDIER SKITTLES,,HAND WARMER UNION JACK,ASSORTED COLOUR BIRD ORNAMENT,WHITE METAL LANTERN,SET OF 3 COLOURED  FLYING DUCKS,RED RETROSPOT MUG,HAND WARMER UNION JACK,,BOUDOIR SQUARE TISSUE BOX,PAPER CHAIN KIT VINTAGE CHRISTMAS,POSTAGE,CLEAR DRAWER KNOB ACRYLIC EDWARDIAN,,WHITE METAL LANTERN,HAND WARMER UNION JACK,MAGIC DRAWING SLATE BAKE A CAKE ,WHITE SKULL HOT WATER BOTTLE ,LUNCH BAG SPACEBOY DESIGN 
WHITE METAL LANTERN,,POPPY'S PLAYHOUSE KITCHEN,YELLOW COAT RACK PARIS FASHION,,ALARM CLOCK BAKELIKE GREEN,,,CREAM CUPID HEARTS COAT HANGER,,CREAM CUPID HEARTS COAT HANGER,,,JUMBO BAG CHARLIE AND LOLA TOYS,,JUMBO SHOPPER VINTAGE RED PAISLEY,,CHOCOLATE CALCULATOR,,HANGING METAL HEART LANTERN,JAM MAKING SET WITH JARS,JUMBO BAG RED RETROSPOT,WOODEN OWLS LIGHT GARLAND ,DOORMAT FANCY FONT HOME SWEET HOME,VINTAGE HEADS AND TAILS CARD GAME ,JAM MAKING SET PRINTED,PACK OF 12 BLUE PAISLEY TISSUES ,TRADITIONAL WOODEN SKIPPING ROPE,,HAND WARMER SCOTTY DOG DESIGN,PACK OF 60 PINK PAISLEY CAKE CASES,CREAM CUPID HEARTS COAT HANGER,,BABUSHKA LIGHTS STRING OF 10,,,SKULLS SQUARE TISSUE BOX,HOT WATER BOTTLE BABUSHKA ,,PINK DRAWER KNOB ACRYLIC EDWARDIAN,,CREAM CUPID HEARTS COAT HANGER,,12 PENCILS TALL TUBE SKULLS,SCOTTIE DOG HOT WATER BOTTLE,ROUND SNACK BOXES SET OF4 WOODLAND 
CREAM CUPID HEARTS COAT HANGER,,FELTCRAFT PRINCESS CHARLOTTE DOLL,BLUE COAT RACK PARIS FASHION,,PANDA AND BUNNIES STICKER SHEET,,,EDWARDIAN PARASOL RED,,EDWARDIAN PARASOL RED,,,STRAWBERRY CHARLOTTE BAG,,"AIRLINE LOUNGE,METAL SIGN",,JUMBO SHOPPER VINTAGE RED PAISLEY,,HANGING MEDINA LANTERN SMALL,JUMBO BAG DOLLY GIRL DESIGN,,FAIRY TALE COTTAGE NIGHTLIGHT,HOME SMALL WOOD LETTERS,SET OF 3 COLOURED  FLYING DUCKS,JAM JAR WITH PINK LID,PACK OF 12 RED RETROSPOT TISSUES ,WOODEN BOX OF DOMINOES,,HAND WARMER OWL DESIGN,60 TEATIME FAIRY CAKE CASES,EDWARDIAN PARASOL BLACK,,PIGGY BANK RETROSPOT ,,,PHOTO FRAME CORNICE,,,GREEN DRAWER KNOB ACRYLIC EDWARDIAN,,EDWARDIAN PARASOL RED,,CHOCOLATE CALCULATOR,SQUARECUSHION COVER PINK UNION FLAG,LUNCH BAG DOLLY GIRL DESIGN
KNITTED UNION FLAG HOT WATER BOTTLE,,IVORY KNITTED MUG COSY ,,,STARS GIFT TAPE ,,,RETRO COFFEE MUGS ASSORTED,,RETRO COFFEE MUGS ASSORTED,,,RED 3 PIECE RETROSPOT CUTLERY SET,,WHITE SPOT RED CERAMIC DRAWER KNOB,,RECYCLING BAG RETROSPOT ,,NATURAL SLATE HEART CHALKBOARD ,TRADITIONAL CHRISTMAS RIBBONS,,RED TOADSTOOL LED NIGHT LIGHT,GINGHAM HEART  DOORSTOP RED,SET OF 3 GOLD FLYING DUCKS,JAM JAR WITH GREEN LID,CHICK GREY HOT WATER BOTTLE,RUSTIC  SEVENTEEN DRAWER SIDEBOARD,,HAND WARMER RED RETROSPOT,PACK OF 72 RETROSPOT CAKE CASES,EDWARDIAN PARASOL RED,,SET 7 BABUSHKA NESTING BOXES,,,SILK PURSE BABUSHKA RED,,,BLUE DRAWER KNOB ACRYLIC EDWARDIAN,,RETRO COFFEE MUGS ASSORTED,,RED  HARMONICA IN BOX ,SPACEBOY CHILDRENS EGG CUP,LUNCH BAG SUKI  DESIGN 
RED WOOLLY HOTTIE WHITE HEART.,,BOX OF 6 ASSORTED COLOUR TEASPOONS,,,INFLATABLE POLITICAL GLOBE ,,,SAVE THE PLANET MUG,,SAVE THE PLANET MUG,,,BLUE 3 PIECE POLKADOT CUTLERY SET,,RED DRAWER KNOB ACRYLIC EDWARDIAN,,TOY TIDY PINK POLKADOT,,HEART OF WICKER SMALL,ORGANISER WOOD ANTIQUE WHITE ,,,FIVE HEART HANGING DECORATION,RED RETROSPOT UMBRELLA,ROSE COTTAGE KEEPSAKE BOX ,PLASTERS IN TIN VINTAGE PAISLEY ,PARTY CONES CARNIVAL ASSORTED,,RETROSPOT HEART HOT WATER BOTTLE,CHICK GREY HOT WATER BOTTLE,RETRO COFFEE MUGS ASSORTED,,DOORMAT FAIRY CAKE,,,PICTURE DOMINOES,,,HEART OF WICKER SMALL,,SAVE THE PLANET MUG,,BLUE HARMONICA IN BOX ,CHILDREN'S SPACEBOY MUG,LUNCH BAG  BLACK SKULL.
SET 7 BABUSHKA NESTING BOXES,,BOX OF VINTAGE JIGSAW BLOCKS ,,,VINTAGE HEADS AND TAILS CARD GAME ,,,VINTAGE BILLBOARD DRINK ME MUG,,VINTAGE BILLBOARD DRINK ME MUG,,,SET/6 RED SPOTTY PAPER PLATES,,CLEAR DRAWER KNOB ACRYLIC EDWARDIAN,,ANTIQUE GLASS DRESSING TABLE POT,,HEART OF WICKER LARGE,LUNCH BAG DOLLY GIRL DESIGN,,,HANGING METAL HEART LANTERN,BLACK/BLUE POLKADOT UMBRELLA,HANGING HEART ZINC T-LIGHT HOLDER,PLASTERS IN TIN SKULLS,PARTY CONES CANDY ASSORTED,,DOG BOWL CHASING BALL DESIGN,SMALL GLASS HEART TRINKET POT,SAVE THE PLANET MUG,,HAND WARMER RED RETROSPOT,,,S/6 SEW ON CROCHET FLOWERS,,,SMALL POPCORN HOLDER,,VINTAGE BILLBOARD DRINK ME MUG,,SKULLS  WATER TRANSFER TATTOOS ,HAND WARMER SCOTTY DOG DESIGN,ROUND SNACK BOXES SET OF 4 FRUITS 
GLASS STAR FROSTED T-LIGHT HOLDER,,BOX OF VINTAGE ALPHABET BLOCKS,,,SET/2 RED RETROSPOT TEA TOWELS ,,,VINTAGE BILLBOARD LOVE/HATE MUG,,VINTAGE BILLBOARD LOVE/HATE MUG,,,LUNCH BAG RED RETROSPOT,,PHOTO CLIP LINE,,ALARM CLOCK BAKELIKE GREEN,,WHITE LOVEBIRD LANTERN,,,,ASSORTED BOTTLE TOP  MAGNETS ,RED DINER WALL CLOCK,PAPER CHAIN KIT VINTAGE CHRISTMAS,,PICNIC BASKET WICKER SMALL,,CLOTHES PEGS RETROSPOT PACK 24 ,ALARM CLOCK BAKELIKE IVORY,VINTAGE BILLBOARD DRINK ME MUG,,HAND WARMER SCOTTY DOG DESIGN,,,SCANDINAVIAN REDS RIBBONS,,,SET 6 FOOTBALL CELEBRATION CANDLES,,VINTAGE BILLBOARD LOVE/HATE MUG,,PACK 3 BOXES BIRD PANNETONE ,FELTCRAFT CUSHION OWL,ROUND SNACK BOXES SET OF 4 SKULLS
,,HOME BUILDING BLOCK WORD,,,ROUND SNACK BOXES SET OF4 WOODLAND ,,,WOOD 2 DRAWER CABINET WHITE FINISH,,WOOD 2 DRAWER CABINET WHITE FINISH,,,STRAWBERRY LUNCH BOX WITH CUTLERY,,FELT EGG COSY CHICKEN,,IVORY GIANT GARDEN THERMOMETER,,CLASSIC METAL BIRDCAGE PLANT HOLDER,,,,FRIDGE MAGNETS US DINER ASSORTED,ALARM CLOCK BAKELIKE GREEN,DISCO BALL CHRISTMAS DECORATION,,ASSORTED COLOUR BIRD ORNAMENT,,HAND OVER THE CHOCOLATE   SIGN ,ALARM CLOCK BAKELIKE RED ,VINTAGE BILLBOARD LOVE/HATE MUG,,HAND WARMER OWL DESIGN,,,BALLOONS  WRITING SET ,,,SET OF 6 GIRLS CELEBRATION CANDLES,,WOOD 2 DRAWER CABINET WHITE FINISH,,HOT WATER BOTTLE TEA AND SYMPATHY,BLACK CANDELABRA T-LIGHT HOLDER,DOLLY GIRL LUNCH BOX
,,LOVE BUILDING BLOCK WORD,,,SPACEBOY LUNCH BOX ,,,WOOD S/3 CABINET ANT WHITE FINISH,,WOOD S/3 CABINET ANT WHITE FINISH,,,LUNCH BOX WITH CUTLERY RETROSPOT ,,PIGGY BANK RETROSPOT ,,3 TIER CAKE TIN GREEN AND CREAM,,CREAM HEART CARD HOLDER,,,,HOMEMADE JAM SCENTED CANDLES,ALARM CLOCK BAKELIKE RED ,WHITE HANGING HEART T-LIGHT HOLDER,,STAR DECORATION PAINTED ZINC ,,WHITE HANGING HEART T-LIGHT HOLDER,ALARM CLOCK BAKELIKE ORANGE,WOOD 2 DRAWER CABINET WHITE FINISH,,STRAWBERRY CERAMIC TRINKET BOX,,,JAM MAKING SET PRINTED,,,ROMANTIC PINKS RIBBONS ,,WOOD S/3 CABINET ANT WHITE FINISH,,RED WOOLLY HOTTIE WHITE HEART.,TOY TIDY DOLLY GIRL DESIGN,SPACEBOY LUNCH BOX 
,,RECIPE BOX WITH METAL HEART,,,LUNCH BOX I LOVE LONDON,,,WOODEN PICTURE FRAME WHITE FINISH,,WOODEN PICTURE FRAME WHITE FINISH,,,PACK OF 72 RETROSPOT CAKE CASES,,SKULL SHOULDER BAG,,3 TIER CAKE TIN RED AND CREAM,,ENAMEL FLOWER JUG CREAM,,,,FRIDGE MAGNETS LES ENFANTS ASSORTED,BLUE DINER WALL CLOCK,SMALL POPCORN HOLDER,,,,TRAVEL SEWING KIT,ALARM CLOCK BAKELIKE GREEN,WOOD S/3 CABINET ANT WHITE FINISH,,PINK DOUGHNUT TRINKET POT ,,,LAVENDER INCENSE IN TIN,,,BRIGHT BLUES RIBBONS ,,WOODEN PICTURE FRAME WHITE FINISH,,WHITE SKULL HOT WATER BOTTLE ,SET 12 LAVENDER  BOTANICAL T-LIGHTS,GREEN POLKADOT PLATE 
,,DOORMAT NEW ENGLAND,,,CIRCUS PARADE LUNCH BOX ,,,WOODEN FRAME ANTIQUE WHITE ,,WOODEN FRAME ANTIQUE WHITE ,,,PACK OF 60 DINOSAUR CAKE CASES,,YOU'RE CONFUSING ME METAL SIGN ,,SET 3 WICKER OVAL BASKETS W LIDS,,ENAMEL FIRE BUCKET CREAM,,,,ROSE CARAVAN DOORSTOP,IVORY DINER WALL CLOCK,LARGE POPCORN HOLDER ,,,,,HOT WATER BOTTLE TEA AND SYMPATHY,WOODEN PICTURE FRAME WHITE FINISH,,SILK PURSE BABUSHKA PINK,,,TV DINNER TRAY VINTAGE PAISLEY,,,SCANDINAVIAN REDS RIBBONS,,WOODEN FRAME ANTIQUE WHITE ,,3 PIECE SPACEBOY COOKIE CUTTER SET,UNION JACK FLAG LUGGAGE TAG,BLUE POLKADOT PLATE 
,,,,,CHARLOTTE BAG DOLLY GIRL DESIGN,,,KNITTED UNION FLAG HOT WATER BOTTLE,,KNITTED UNION FLAG HOT WATER BOTTLE,,,PACK OF 60 PINK PAISLEY CAKE CASES,,COOK WITH WINE METAL SIGN ,,,,ENAMEL BREAD BIN CREAM,,,,HEART OF WICKER SMALL,LARGE HEART MEASURING SPOONS,RETROSPOT LARGE MILK JUG,,,,,HAND WARMER BIRD DESIGN,WOODEN FRAME ANTIQUE WHITE ,,HOT WATER BOTTLE TEA AND SYMPATHY,,,SET OF 4 ENGLISH ROSE PLACEMATS,,,CHOCOLATE BOX RIBBONS ,,KNITTED UNION FLAG HOT WATER BOTTLE,,SET OF 20 KIDS COOKIE CUTTERS,RED HEART LUGGAGE TAG,RED RETROSPOT PLATE 
,,,,,RED TOADSTOOL LED NIGHT LIGHT,,,RED WOOLLY HOTTIE WHITE HEART.,,RED WOOLLY HOTTIE WHITE HEART.,,,60 TEATIME FAIRY CAKE CASES,,GIN + TONIC DIET METAL SIGN,,,,,,,,5 HOOK HANGER MAGIC TOADSTOOL,SMALL HEART MEASURING SPOONS,SET/20 RED RETROSPOT PAPER NAPKINS ,,,,,HAND WARMER SCOTTY DOG DESIGN,KNITTED UNION FLAG HOT WATER BOTTLE,,HOT WATER BOTTLE I AM SO POORLY,,,SET OF 4 ENGLISH ROSE COASTERS,,,PARTY INVITES FOOTBALL,,RED WOOLLY HOTTIE WHITE HEART.,,10 COLOUR SPACEBOY PEN,RED GLASS TASSLE BAG CHARM,PINK  POLKADOT PLATE 
,,,,, SET 2 TEA TOWELS I LOVE LONDON ,,,SET 7 BABUSHKA NESTING BOXES,,SET 7 BABUSHKA NESTING BOXES,,,TOMATO CHARLIE+LOLA COASTER SET,,YELLOW BREAKFAST CUP AND SAUCER,,,,,,,,,,SET/6 RED SPOTTY PAPER PLATES,,,,,,RED WOOLLY HOTTIE WHITE HEART.,,CHOCOLATE HOT WATER BOTTLE,,,TRIPLE PHOTO FRAME CORNICE ,,,PARTY INVITES JAZZ HEARTS,,SET 7 BABUSHKA NESTING BOXES,,VICTORIAN GLASS HANGING T-LIGHT,CLEAR ACRYLIC FACETED BANGLE,ROUND SNACK BOXES SET OF 4 SKULLS
,,,,,VINTAGE SEASIDE JIGSAW PUZZLES,,,GLASS STAR FROSTED T-LIGHT HOLDER,,GLASS STAR FROSTED T-LIGHT HOLDER,,,CHARLIE & LOLA WASTEPAPER BIN FLORA,,PINK BREAKFAST CUP AND SAUCER ,,,,,,,,,,SET/6 RED SPOTTY PAPER CUPS,,,,,,SET 7 BABUSHKA NESTING BOXES,,WHITE SKULL HOT WATER BOTTLE ,,,FAMILY PHOTO FRAME CORNICE,,,PARTY INVITES SPACEMAN,,IVORY EMBROIDERED QUILT ,,SINGLE HEART ZINC T-LIGHT HOLDER,5 STRAND GLASS NECKLACE CRYSTAL,FELTCRAFT DOLL MOLLY
,,,,,MINI JIGSAW CIRCUS PARADE ,,,,,,,,RED CHARLIE+LOLA PERSONAL DOORSIGN,,PAPER CHAIN KIT 50'S CHRISTMAS ,,,,,,,,,,POLKADOT RAIN HAT ,,,,,,IVORY EMBROIDERED QUILT ,,SCOTTIE DOG HOT WATER BOTTLE,,,MIRRORED DISCO BALL ,,,SET OF 3 BUTTERFLY COOKIE CUTTERS,,GLASS STAR FROSTED T-LIGHT HOLDER,,RED HANGING HEART T-LIGHT HOLDER,DOORMAT UNION JACK GUNS AND ROSES,FELTCRAFT CHRISTMAS FAIRY
,,,,,MINI JIGSAW SPACEBOY,,,,,,,,JUMBO STORAGE BAG SUKI,,PAPER CHAIN KIT RETROSPOT,,,,,,,,,,DELUXE SEWING KIT ,,,,,,GLASS STAR FROSTED T-LIGHT HOLDER,,,,,DISCO BALL ROTATOR BATTERY OPERATED,,,SET OF 3 HEART COOKIE CUTTERS,,,,HANGING METAL STAR LANTERN,VANILLA SCENT CANDLE JEWELLED BOX,TRAVEL SEWING KIT
,,,,,MINI PAINT SET VINTAGE ,,,,,,,,JUMBO BAG PINK VINTAGE PAISLEY,,SMALL HEART FLOWERS HOOK ,,,,,,,,,,RETROSPOT HEART HOT WATER BOTTLE,,,,,,,,,,,SILVER LOOKING MIRROR,,,3 PIECE SPACEBOY COOKIE CUTTER SET,,,,SILVER HANGING T-LIGHT HOLDER,FULL ENGLISH BREAKFAST PLATE,SET OF 3 NOTEBOOKS IN PARCEL
,,,,,POSTAGE,,,,,,,,,,PHOTO CLIP LINE,,,,,,,,,,KNITTED UNION FLAG HOT WATER BOTTLE,,,,,,,,,,,LADIES & GENTLEMEN METAL SIGN,,,PACK OF 72 SKULL CAKE CASES,,,,DOORMAT RED RETROSPOT,BLACK CANDELABRA T-LIGHT HOLDER,RED RETROSPOT TAPE
,,,,,,,,,,,,,,,TEA TIME DES TEA COSY,,,,,,,,,,ENGLISH ROSE HOT WATER BOTTLE,,,,,,,,,,,METAL SIGN HER DINNER IS SERVED ,,,PACK OF 60 SPACEBOY CAKE CASES,,,,DOORMAT HEARTS,MAGIC DRAWING SLATE CIRCUS PARADE  ,COSY SLIPPER SHOES SMALL  RED 
,,,,,,,,,,,,,,,FELT EGG COSY WHITE RABBIT ,,,,,,,,,,PHOTO CUBE,,,,,,,,,,,YOU'RE CONFUSING ME METAL SIGN ,,,PACK OF 72 RETROSPOT CAKE CASES,,,,NATURAL SLATE RECTANGLE CHALKBOARD,CHRISTMAS HANGING HEART WITH BELL,6 RIBBONS RUSTIC CHARM
,,,,,,,,,,,,,,,ZINC WILLIE WINKIE  CANDLE STICK,,,,,,,,,,HOMEMADE JAM SCENTED CANDLES,,,,,,,,,,,DOORMAT TOPIARY,,,72 SWEETHEART FAIRY CAKE CASES,,,,LOVEBIRD HANGING DECORATION WHITE ,CAKE STAND VICTORIAN FILIGREE MED,SCANDINAVIAN REDS RIBBONS
,,,,,,,,,,,,,,,CERAMIC CHERRY CAKE MONEY BANK,,,,,,,,,,JUMBO BAG RED RETROSPOT,,,,,,,,,,,BATHROOM METAL SIGN,,,PACK OF 60 DINOSAUR CAKE CASES,,,,ASSORTED COLOUR BIRD ORNAMENT,PAISLEY PATTERN  STICKERS,JAM MAKING SET PRINTED
,,,,,,,,,,,,,,,RETROSPOT LARGE MILK JUG,,,,,,,,,,,,,,,,,,,,,KITCHEN METAL SIGN,,,LUNCH BAG SUKI  DESIGN ,,,,HOME BUILDING BLOCK WORD,FLOWERS  STICKERS,12 DAISY PEGS IN WOOD BOX
,,,,,,,,,,,,,,,SET OF 6 FUNKY BEAKERS,,,,,,,,,,,,,,,,,,,,,TOILET METAL SIGN,,,LUNCH BAG CARS BLUE,,,,LOVE BUILDING BLOCK WORD,PINK NEW BAROQUECANDLESTICK CANDLE,HOT WATER BOTTLE BABUSHKA 
,,,,,,,,,,,,,,,EDWARDIAN PARASOL BLACK,,,,,,,,,,,,,,,,,,,,,METAL SIGN TAKE IT OR LEAVE IT ,,,LUNCH BAG  BLACK SKULL.,,,,PHOTO FRAME CORNICE,BLUE NEW BAROQUE CANDLESTICK CANDLE,FELTCRAFT PRINCESS CHARLOTTE DOLL
,,,,,,,,,,,,,,,EDWARDIAN PARASOL NATURAL,,,,,,,,,,,,,,,,,,,,,I'M ON HOLIDAY METAL SIGN,,,HEART IVORY TRELLIS LARGE,,,,PENS ASSORTED FUNNY FACE,JUMBO STORAGE BAG SUKI,FELTCRAFT CHRISTMAS FAIRY
,,,,,,,,,,,,,,,CERAMIC STRAWBERRY CAKE MONEY BANK,,,,,,,,,,,,,,,,,,,,,GROW YOUR OWN BASIL IN ENAMEL MUG,,,,,,,CARD CIRCUS PARADE,BLACK LOVE BIRD CANDLE,FELTCRAFT PRINCESS CHARLOTTE DOLL
,,,,,,,,,,,,,,,BLUE OWL SOFT TOY,,,,,,,,,,,,,,,,,,,,,SET/10 PINK POLKADOT PARTY CANDLES,,,,,,,WRAP COWBOYS  ,PARTY TIME PENCIL ERASERS,6 RIBBONS RUSTIC CHARM
,,,,,,,,,,,,,,,BALLOON ART MAKE YOUR OWN FLOWERS,,,,,,,,,,,,,,,,,,,,,SET 20 NAPKINS FAIRY CAKES DESIGN ,,,,,,,AIRLINE BAG VINTAGE TOKYO 78,DISCO BALL CHRISTMAS DECORATION,COSY SLIPPER SHOES SMALL  RED 
,,,,,,,,,,,,,,,RED TOADSTOOL LED NIGHT LIGHT,,,,,,,,,,,,,,,,,,,,,60 TEATIME FAIRY CAKE CASES,,,,,,,RED RETROSPOT UMBRELLA,PINK B'FLY C/COVER W BOBBLES,SCANDINAVIAN REDS RIBBONS
,,,,,,,,,,,,,,,GLASS CLOCHE SMALL,,,,,,,,,,,,,,,,,,,,,SET OF 6 T-LIGHTS SNOWMEN,,,,,,,BLACK/BLUE POLKADOT UMBRELLA,PINK UNION JACK  LUGGAGE TAG,5 HOOK HANGER RED MAGIC TOADSTOOL
,,,,,,,,,,,,,,,GUMBALL MONOCHROME COAT RACK,,,,,,,,,,,,,,,,,,,,,SET OF 6 T-LIGHTS SANTA,,,,,,,RED 3 PIECE RETROSPOT CUTLERY SET,6 RIBBONS ELEGANT CHRISTMAS ,CHRISTMAS CRAFT TREE TOP ANGEL
,,,,,,,,,,,,,,,DOORMAT FANCY FONT HOME SWEET HOME,,,,,,,,,,,,,,,,,,,,,SET OF 9 HEART SHAPED BALLOONS,,,,,,,PACK OF 72 RETROSPOT CAKE CASES,UNION JACK FLAG LUGGAGE TAG,CHRISTMAS CRAFT LITTLE FRIENDS
,,,,,,,,,,,,,,,,,,,,,,,,,,,,,,,,,,,,SANDWICH BATH SPONGE,,,,,,,SET OF 72 RETROSPOT PAPER  DOILIES,AGED GLASS SILVER T-LIGHT HOLDER,5 HOOK HANGER RED MAGIC TOADSTOOL
,,,,,,,,,,,,,,,,,,,,,,,,,,,,,,,,,,,,APPLE BATH SPONGE,,,,,,,BLUE COAT RACK PARIS FASHION,BOOM BOX SPEAKER GIRLS,6 RIBBONS RUSTIC CHARM
,,,,,,,,,,,,,,,,,,,,,,,,,,,,,,,,,,,,STRAWBERRY BATH SPONGE ,,,,,,,PLASTERS IN TIN SKULLS,6 RIBBONS SHIMMERING PINKS ,12 DAISY PEGS IN WOOD BOX
,,,,,,,,,,,,,,,,,,,,,,,,,,,,,,,,,,,,BLACK PIRATE TREASURE CHEST,,,,,,,SLEEPING CAT ERASERS, SET 2 TEA TOWELS I LOVE LONDON ,SET OF 3 NOTEBOOKS IN PARCEL
,,,,,,,,,,,,,,,,,,,,,,,,,,,,,,,,,,,,STAR PORTABLE TABLE LIGHT ,,,,,,,CARD BIRTHDAY COWBOY,JUMBO BAG OWLS,5 HOOK HANGER MAGIC TOADSTOOL
,,,,,,,,,,,,,,,,,,,,,,,,,,,,,,,,,,,,SNOWFLAKE PORTABLE TABLE LIGHT ,,,,,,,PACK 3 BOXES CHRISTMAS PANNETONE,SANDWICH BATH SPONGE,SCANDINAVIAN REDS RIBBONS
,,,,,,,,,,,,,,,,,,,,,,,,,,,,,,,,,,,,PINK OVAL JEWELLED MIRROR,,,,,,,ROTATING SILVER ANGELS T-LIGHT HLDR,OWL DOORSTOP,RED TOADSTOOL LED NIGHT LIGHT
,,,,,,,,,,,,,,,,,,,,,,,,,,,,,,,,,,,,RETROSPOT CIGAR BOX MATCHES ,,,,,,,COSY HOUR GIANT TUBE MATCHES,5 STRAND GLASS NECKLACE CRYSTAL,5 HOOK HANGER RED MAGIC TOADSTOOL
,,,,,,,,,,,,,,,,,,,,,,,,,,,,,,,,,,,,COSY HOUR GIANT TUBE MATCHES,,,,,,,RIBBON REEL MAKING SNOWMEN ,HAND WARMER UNION JACK,COSY SLIPPER SHOES SMALL GREEN
,,,,,,,,,,,,,,,,,,,,,,,,,,,,,,,,,,,,JAZZ HEARTS PURSE NOTEBOOK,,,,,,,MINI PAINT SET VINTAGE ,HAND WARMER SCOTTY DOG DESIGN,COSY SLIPPER SHOES SMALL  RED 
,,,,,,,,,,,,,,,,,,,,,,,,,,,,,,,,,,,,LUNCH BAG DOLLY GIRL DESIGN,,,,,,,4 TRADITIONAL SPINNING TOPS,LARGE POPCORN HOLDER ,FELTCRAFT DOLL ROSIE
,,,,,,,,,,,,,,,,,,,,,,,,,,,,,,,,,,,,WHITE HANGING HEART T-LIGHT HOLDER,,,,,,,SET OF 6 SOLDIER SKITTLES,PAINTED METAL STAR WITH HOLLY BELLS,FELTCRAFT DOLL MOLLY
,,,,,,,,,,,,,,,,,,,,,,,,,,,,,,,,,,,,CANDLEHOLDER PINK HANGING HEART,,,,,,,BAG 500g SWIRLY MARBLES,PAINTED METAL HEART WITH HOLLY BELL,FELTCRAFT DOLL EMILY
,,,,,,,,,,,,,,,,,,,,,,,,,,,,,,,,,,,,WOOD 2 DRAWER CABINET WHITE FINISH,,,,,,,,ANGEL DECORATION STARS ON DRESS,FELTCRAFT PRINCESS CHARLOTTE DOLL
,,,,,,,,,,,,,,,,,,,,,,,,,,,,,,,,,,,,ASSORTED COLOUR MINI CASES,,,,,,,,SMALL POPCORN HOLDER,FELTCRAFT PRINCESS OLIVIA DOLL
,,,,,,,,,,,,,,,,,,,,,,,,,,,,,,,,,,,,LUNCH BAG RED RETROSPOT,,,,,,,,JUMBO BAG RED RETROSPOT,REX CASH+CARRY JUMBO SHOPPER
,,,,,,,,,,,,,,,,,,,,,,,,,,,,,,,,,,,,LUNCH BAG SPACEBOY DESIGN ,,,,,,,,JUMBO BAG STRAWBERRY,FELTCRAFT DOLL MOLLY
,,,,,,,,,,,,,,,,,,,,,,,,,,,,,,,,,,,,LUNCH BAG WOODLAND,,,,,,,,STRAWBERRY SHOPPER BAG,FELTCRAFT CUSHION OWL
,,,,,,,,,,,,,,,,,,,,,,,,,,,,,,,,,,,,LUNCH BAG PINK POLKADOT,,,,,,,,STRAWBERRY CHARLOTTE BAG,CHRISTMAS CRAFT TREE TOP ANGEL
,,,,,,,,,,,,,,,,,,,,,,,,,,,,,,,,,,,,GUMBALL COAT RACK,,,,,,,, SET 2 TEA TOWELS I LOVE LONDON ,CHRISTMAS CRAFT LITTLE FRIENDS
,,,,,,,,,,,,,,,,,,,,,,,,,,,,,,,,,,,,BLUE NEW BAROQUE CANDLESTICK CANDLE,,,,,,,,PACK OF 12 RED RETROSPOT TISSUES ,FELTCRAFT CUSHION RABBIT
,,,,,,,,,,,,,,,,,,,,,,,,,,,,,,,,,,,,PINK NEW BAROQUECANDLESTICK CANDLE,,,,,,,,SCOTTIE DOG HOT WATER BOTTLE,FELTCRAFT CUSHION BUTTERFLY
,,,,,,,,,,,,,,,,,,,,,,,,,,,,,,,,,,,,FAIRY CAKE FLANNEL ASSORTED COLOUR,,,,,,,,CHOCOLATE HOT WATER BOTTLE,12 DAISY PEGS IN WOOD BOX
,,,,,,,,,,,,,,,,,,,,,,,,,,,,,,,,,,,,BREAD BIN DINER STYLE PINK,,,,,,,,,PAPER CHAIN KIT 50'S CHRISTMAS 
,,,,,,,,,,,,,,,,,,,,,,,,,,,,,,,,,,,,JUMBO BAG CHARLIE AND LOLA TOYS,,,,,,,,,
,,,,,,,,,,,,,,,,,,,,,,,,,,,,,,,,,,,,TEA TIME TABLE CLOTH,,,,,,,,,
,,,,,,,,,,,,,,,,,,,,,,,,,,,,,,,,,,,,ENGLISH ROSE HOT WATER BOTTLE,,,,,,,,,
,,,,,,,,,,,,,,,,,,,,,,,,,,,,,,,,,,,,ENAMEL FIRE BUCKET CREAM,,,,,,,,,
,,,,,,,,,,,,,,,,,,,,,,,,,,,,,,,,,,,,PICNIC BASKET WICKER SMALL,,,,,,,,,
